{
    "meta": {
        "protocol_version": "1.0.0",
        "schema_version": "1.0.0",
        "created_at": "2025-01-01T00:00:00.000Z"
    },
    "network_id": "550e8400-e29b-41d4-a716-446655440000",
    "context_id": "550e8400-e29b-41d4-a716-446655440001",
    "name": "Test Network",
    "topology_type": "single_node",
    "status": "draft",
    "events": [
        {
            "event_id": "550e8400-e29b-41d4-a716-446655440200",
            "event_type": "network.created",
            "source": "network",
            "timestamp": "2025-01-01T00:00:00.000Z"
        }
    ]
}